{
  "operation_id": "op_s11_cocreation_001",
  "scenario_id": "S11",
  "current_state": "approved",
  "event_ids": [
    "evt_s11_content_gap_001",
    "evt_s11_draft_generate_001"
  ],
  "xai_card_ids": [
    "xai_s11_cocreation_001"
  ],
  "approval_ids": [
    "approval_s11_bridge_variant_001"
  ],
  "measurement_plan_id": "measure_s11_draft_effect_001",
  "transitions": [
    {
      "from": "drafted",
      "to": "evidence_attached",
      "at": "2026-04-11T09:03:00+09:00",
      "evidence": ["evt_s11_content_gap_001"]
    },
    {
      "from": "evidence_attached",
      "to": "policy_checked",
      "at": "2026-04-11T09:04:00+09:00",
      "policy_gate_result": "G2_requires_instructor_approval"
    },
    {
      "from": "policy_checked",
      "to": "awaiting_approval",
      "at": "2026-04-11T09:05:00+09:00",
      "approval_required": "G2"
    },
    {
      "from": "awaiting_approval",
      "to": "approved",
      "at": "2026-04-11T09:16:00+09:00",
      "approval_granted": "approval_s11_bridge_variant_001"
    }
  ]
}
