{
  "operation_id": "op_s12_pace_agent_001",
  "scenario_id": "S12",
  "current_state": "approved",
  "event_ids": [
    "evt_s12_pace_signal_001",
    "evt_s12_plan_generate_001"
  ],
  "xai_card_ids": [
    "xai_s12_pace_agent_001"
  ],
  "approval_ids": [
    "approval_s12_pace_plan_001"
  ],
  "measurement_plan_id": "measure_s12_plan_completion_001",
  "transitions": [
    {
      "from": "drafted",
      "to": "evidence_attached",
      "at": "2026-04-12T08:41:00+09:00",
      "evidence": ["evt_s12_pace_signal_001"]
    },
    {
      "from": "evidence_attached",
      "to": "policy_checked",
      "at": "2026-04-12T08:42:00+09:00",
      "policy_gate_result": "G1_requires_student_approval"
    },
    {
      "from": "policy_checked",
      "to": "awaiting_approval",
      "at": "2026-04-12T08:42:30+09:00",
      "approval_required": "G1"
    },
    {
      "from": "awaiting_approval",
      "to": "approved",
      "at": "2026-04-12T08:43:00+09:00",
      "approval_granted": "approval_s12_pace_plan_001"
    }
  ]
}
